label	text_a	rule
0	Gdje je onaj paćenik Muhvić....	
0	Kakve gluposti djeca trenutno uče, ovo će sigurno biti bolje. Koliko bolje, vjerovatno ne puno, ali ipak.	
0	Daj ju vidi kako sjedi. Omfg	
0	Treba se ispisati iz crkve, prestati gledati rtl i čitati 24sata i odmah si na konju.	
1	A za kilu trave dobijes 2-3g...mater vam jebb nacisticku.. Ovohj zeni /djevojci zivot unisten nepovratno i nikom nista, a za malo vutre robijas ko da si pedofil..	8
0	Tribalo je nju po kratkom postupku optužiti na maksimalnu kaznu.  Pa onda neka dokazuje do mile volje da nije kriva.	
0	Hž uživajte u putovanju!!...sa nama stižete uvijek na vrijeme	
0	znači u 10 sati počinje bezvezno laprdanje o niškoristi, a nakon napornog baljezganja kreće lezi lebe da te jedem 	
0	"reagirat ce ""lijepa prica"" ne brinite... 
500 tisuca eura i misko sretan hahhahaa"	
0	:)))) Želite li pronaći ženu za jednu noć? Dobrodošli na ==> www.3xDate.top	1
0	Maminjo moras shvatiti da su bili veci klub od tvojih modri	1
0	preporučio bi im čačića, njemu je dovoljno samo 11 igrača za svaku utakmicu	
0	"Google sAda plaća $ 17000 do $ 22000 mjesečno za rad na mreži od kuće. Pridružio sam se ovom poslu prije 2 mjeseca i zaradio sam 20544 dolara u prvom mjesecu od ovog posla. 

--------------->>>>> www.WebJob33.Com"	1
0	a dobro..danas su se pojmovi u kulinarstvu promijenili i proširili što i nije uvijek dobro..meni je štrudla sve sa dizanim tijestom, ostalo su ili savijače ili pite..nema trećeg..ok i ima i varijanta sa prhkim tijestom koje se rola ali to su već varijacije na temu..meni osobno zeljanica ili zeljanik kada je špinat u pitanju najbolji..mada ide i blitva tu i još neki sastojci.	
1	Kretenu.	8
0	Koji glupi članak Bože me sačuvaj..	
1	Oba pedera na okupu	3
0	"Google sada plaća 23859-32746 dolara mjesečno za rad na mreži od kuće. Jako sam sretna jer moram zaraditi puno novca kod kuće i primiti 7642 dolara tjedno. svatko može obaviti ovaj posao i ostvariti više prihoda nna internetu u nepuno radno vrijeme samo slijedite web-lokaciju ......

------------->>>>>  w­w­w.I­n­t­e­r­n­e­t­4­3.C­o­m"	1
0	Koji k  stalno pisete od njima	
0	"Google sada plaća između 15.000 i 30.000 dolara mjesečno za rad na mreži od kuće. Pridružio sam sE ovom poslu prije 3 mjeseca i zaradio 24857 dolara u prvom mjesecu ovog posla.

>>> www.WebJob33.Com"	1
1	Jadni ste vi i stručnjaci i novinari, kad ste ovako bezočno i bezobrazno pristrani. Gdje ste bili i što ste govorili kad je Bujanec proglašen krivim za identičnu stvar? Tada presuda nije bila opasna? Tada je to bilo redu? Sada nije? Ista stvar, identična.	8
0	Ovaj poraz ne znači ništa. Nema šanse da Liverpool propusti ovu priliku! Klopp ima previše iskustva da bi dopustio preokret i pad na tablici. 	
0	A što je to netočno Pupovac rekao? Ali, molim, konkretno.	
0	Izrađujem više od 7 tisuća dolara mjesečno radeći skraćeno radno vrijeme.Čula sam da mi drugi ljudi govore koliko novca mogu zaraditi na internetu,pa sam odlučio da ga pogledam.Pa,sve je to bilo istina i potPuno je promijenilo moj život. ----&gt;&gt;&gt;&gt; www.WebJob33.Com	1
1	nema on mozak da to skuži	8
0	)) Želiš pronaći ženu za jednu noć? Dobrodošli na > > > www.3xDate.top	1
0	Slatke zivotinjice :) :) :) Vozi ih vlakicem :)	1
1	Hehe hvala Koralina ali ti pobjegao komentar u samostalnu rubriku ;) 	8
0	Bas je lik simpa.. zivi djecacki san. :) Bravo	
0	baš je bil lepi onak okrugli...kak pajcek	
0	Bravo,hdz-ovac,umirem od smijeha!	
0	Osobno me zanima, zbog čega vlasnici toga stana nisu srušili taj balkon, ako im netreba?	
0	ode ljeto na hlađenje . ccccccc admine admine !!	
0	ceka se hdz online bojna da krene s pljuvanjem, i zaradi si nesto u ovo subotnje predvecerje	
0	Mislim da se u ovoj utakmici najviše nas pita. Ako smo mi pravi i odigramo kak znamo, nema problema. A vidi se na našim igračima pri svakom pokretu tijela i na licima, da su maksimalno motivirani ušli na ovaj turnir, gladni trofeja. Vjerojatno ih je Lino dodatno nabrijao na temelju nogometnog uspjeha naših u Rusiji i osvajanju Davis Cupa. Danas uvjerljiva pobjeda prptov objektivno najslabijeg protivnika u grupi i onda pokušati potvrditi prolaz u polufinale protiv domaćina Njemačke. Koja kao i Francuzi uopće ne djeluje nepobjedivo. Idemoooo!!!	
1	Na &scaron;ta nam je spala država kad prikazuju ovakve spodobe u udarnom terminu, i jo&scaron; bi to tribalo bit simpatično... Ma mar&scaron; u 3 P. M. !!!!!	8
0	Molim čitatelje skulirajte se s komentarima....Djevojci želim oporavak  ...a ovo se na žalost može svima dogoditi u prometu kiša ....sklizav kolnik su vrag za loše gume  😩	
0	"To su poslijedice čestog prikazivanja filma ""Sam u kući""."	
1	Da bbb dalmacija......koji retard	8
0	Nemogu slijep sam 😜	1
0	Meni je ovaj ponedjeljak počeo lijepo i nadam se da će tako završiti,bit će ti onako kako si napraviš,nema mjesta depresiji!	1
0	"Koja očajnica moraš biti da se prijaviš u emisiju di ti par seljačina opipava mišiće, mjerka ti reproduktivne sposobnosti, bira te ko kobilu na sajmu i udvara ti se rečenicom ""oš ti men' večeras dat'?"", dok ti 24SATA prebire po upotrebljenoj posteljini u potrazi za osušenim tragovima muških tjelesnih izlučevina i jedva čeka uloviti kakav pikantan detalj  dok se hrvatska javnost samozadovoljava nad duckface sličicama i filmićima protagonistica u minićima s vinskom čašom u ruci razine njemačke softpornografije osamdesetih, a perspektiva su ti u najboljem slučaju vožnja u traktoru, gumene čizme i čiščenje svinjca nekakvoj sirovini od seljačine koji te doživljava kao radnu snagu i vreću za spermu nakon zajedničkog gledanja turske serije na pretpotopnom televizoru u nekakvoj donjogudovečkoj pripizdini "	
0	...zijev...((...namjerno svakodnevno po tri puta iritirate ljude sa totalno nebitnom osobom	
0	ako onaj ima normalnoga, ne iskoče mu (mislim ovom, što ga prima....)	
0	Ja znam svojeg brata.On je od rodenja psihicki nestabilan i pasivno agresivan prema svojoj obitelji.Neki ljudi se rode poremeceni i tu nema ljeka.	1
0	"Briga nas u Hrvatskoj gdje je jedan drogeras i propalitet slavio novu godinu svaka cast nasem novinarstvu jer sutra ako bude srao bice to velika vijest
"	
1	Odličan način kako od djeteta ( naravno ako se to veselje nastavi) napraviti razmaženog slona.	8
0	Želiš pronaći ženu za jednu noć? Dobrodošli na > > > www.3xDate.top	1
1	Biće sretna da se rje&scaron;ila debila...	8
1	Trebali su. Trebali su i nasi 95 vise nocnih odradit rijesili bi vas se jednom za uvijek. Ovako stakor na stakoru.	8
0	MOžda je ponekad dobro i šutjeti.	
1	stoko jugonostalgičarska	8
0	Stala sam kod “uzorak nije reprezentativan”, sve dalje je nebitno	
0	Eto pljje&scaron; i konstantno vrijeđa&scaron;. Al takvi ste vi. Ako ti negira&scaron; postojanje ostale bolesne djece u RH a koja boluju od melanoma, leukemje itd. to ne znači da ta bolesna djeca ne postoje! Al neka. Samo pljucaj. Trebalo b pomoć SVOJ bolesnoj djeci a ne samo posebnima, vrednijima, članovima vi&scaron;e kaste itd.	5
1	Upravo to, da je normalna bi po ludila! Mislim da i ona i muz imaju istu dijagnozu, ona mozda i goru jer je majka.	8
0	Ne citam index al lijepo je cut da ti citas	1
0	"Ovo je najbolji posao koji GoogLE sada plaća. Dobio sam prvi mjesec od 27936 eura za rad 3 sata dnevno. Počeo sam prije četiri mjeseca i odmah sam kući odnio najmanje 7645 eura na 9264 eura tjedno.

------- >>>>> www.WebJob33.Com"	1
0	Ok,zgodna cura,malo sitnija...Ali,previše forsira,postaje naporna,nametljiva i od nečeg sexy izazove revolt,i na kraju po nju ispadne kontraproduktivno...	
1	Mudrinić je peder, zbog mačka je ostavio ženu i djecu, on ga financira.	8
0	Na stadionu bez mrlje ???? A slika krvnika na tribinama. Treba li pola Evrope gledati toga koji je ubijao al na njezniji nacin ????	5
1	"Ona se ""povukla iz javnog života"" ali zato je tu 24sata.. u nedostatku ideja, ""sjetili"" se potpuno niškorisnih ljudi i eto objavili samo za čitatelje 24sata urbi et orbi o Marijani i Nemešu"	8
0	Dno dna postaje novinarstvo. Ma u biti vec odavno je to. Sramit morali bi se, ne samo oni koji clanak sastave, nego i oni koji dopustaju objavljivanje.	1
0	Jedini minus transfera Palaverse u Citya je sta mora odigrat odredjeni broj minuta dok je na posudbi...	
1	sta je sa ukrajinom smrade? to neces spomenit?	8
0	"Donosim 86 dolara na sat rADeći od kuće. Bio sam šokiran kad mi je susjed rekao da je u prosjeku 95 dolara, ali vidim kako sada radi. Osjećam toliko slobode sada da sam svoj šef.

ići............>>>> www.WebJob33.Com"	1
0	Ma da crkva je kriva i za tsunamije	1
0	Tolerancije malo više je potrebno .	
0	Digla se gusta magla podno Glavnog Zagrebačkog kolodvora....	
0	Je li napokon vrijeme za Brkićevu ostavku? Dosta je bilo zlostavljanja ovog napačenog naroda	
0	Mikan ima sreće što mu otac nije živ, nabio bi mu rogove s malom	
0	Da sam mlađi sutra bi otiša bez razmišljanja.  Mir, tišina i priroda, šta čovjek još može zamisliti za uživanje.	
0	Ne izmisljajte	1
1	"Ne brine mene srbadija koja dijeli minuse,nego je nazalost veći dio ""naših"" koji dijele minuse."	8
0	Joj daj Niko tjeraj tog zabara, pa taj je valjda kod svakog trenera bio nezadovoljan i bunio se, a realno od 2013. nije spojio 5 postenih utakmica zaredom. Jedan od najodbojnijih likova u danasnjem nogometu	
0	) Želite li pronaći ženu za jednu noć? Dobrodošli na ==>> www.3xDate.top	1
0	Nedugo me je samo jednim detaljem oduševio Plenković. Krenuo je putem nagodbi rješavati pitanja dugogodišnjih i vrlo nepravednih sudskih postupaka, kao onaj s vatrogascem Franom Lučićem. Zamislite koja bi to sreća bila kad bi nam mediokracija postala pravilo u rješavanju sporova a ne izluđivanja s nepotrebnim sudskim postupcima koja traju i preko 15 godina. Ajde, možda naš plenković nastavi savjetima u pravosuđu ovim smjerom. To bi bilo za svaku pohvalu. 	
1	Saopštenje ! Jesam ja na 24 časa ili na 24 sata portalu ?	8
1	E treba taj mladic mislim kreten sudca izlupat tako pa da vidim sto bi ga pustija meni nebi 5 god iz zatvora izisa i to bija bi u samici	3
0	Znači katastrofa je tu haha	
0	Pa tko tebi jos vjeruje?	
0	Tužno..😪😪.. Ode još jedan mladi život..🙏🏼🙏🏼	
0	Pa možda se neće htjeti podsjećati na dane straha,strepnje. U novi život negdje drugdje,sretno	
0	hdzov trol potegnut iz dna vreće	
0	Danas bome svak može pisat članke i kolumne, dovoljno je da udara&scaron; po vladajućoj garnituri	1
0	Više od kluba!	
0	Redovita pedikura i nema problema.	
0	"Google sada plaća $ 17000 do $ 22000 mjesečno za rad na mreži od kuće. Pridružio sam se ovom poslu prije 2 mjeseca i zaradio sam $ 20544 u mom prvom mjesecu od ovog posla.

------>>>>> www.WebJob33.Com"	1
1	Četnik bez brade. Koljač morala i ubojica pozitive.	8
0	Vjerojatno čovjek ima invalidsku iskaznicu, pa je tu parkiral. Inače, puno ljudi ima takvu iskaznicu, a rekel bi da im ni&scaron; nije!	5
0	Čudo da jedna plava mala iz pasaluka dolazi organizirati ne&scaron;to u Zagreb dok u pa&scaron;alhku ru&scaron;e i razvaljuju javnu televiziju koji jad i bjeda !!!!!	5
1	Daj dodji da te izjebem i da si mirna.... Sam da znas 30eura ti je sat vremena,i ponesi gajbu pive	3
0	Kako znaju da su kosti njegove	1
0	Zato jer je najbitnije imati kuma ili kumu na pravom mjestu	
0	Čudo koje te oplemeni onoliko koliko dozvoliš.I toplina koju ne možeš opisati.S a m o podijeliti.	1
0	"Ne vjeruje ona ni u bogeca kojem se ""klanja"" , a kamoli nekakvom sustavu u Rvatistanu. "	
0	"Ovo je najbolji posao koji Google sada plaća. Dobio sam prvi mjesec od 27936 eura za rad 3 sata dnevno. Počeo sam prije četiri mjESeca i odmah sam ponio kući najmanje € 7645 do € 9264 tjedno.

--------->>>>>> www.WebJob33.Com"	1
0	jesi ti ikad bio pijan???	
0	Google sada plaća $ 17000 do $ 22000 mjesečno za rad na mreži od kuće. Pridružio sam se ovom poslu prije 2 mjeseca i zaradio sam $ 20544 u MOm prvom mjesecu od ovog posla.-------->>>> www.WebJob33.Com	1
0	Tocno!	1
0	Ovakvi nadobudni su devedesetih na bausteli u munchenu bili.	
0	Ja svojoj dao prsten i nisam je ni pitao ništa jer sam znao odgovor	
1	De si bre Lazicu,dugo te nije bilo na 24 casa!? Samo Karleusa ovo Karleusa ono,vec sam poceo da brinem covece	8
0	A da  budem  iskren bilo  me  pakšu  i za  ovake  idiotske  tipove  , pa  što  mi  njih dvoje  znače  u  životi,  ništa  čak  ni  ono  što sam  jutros  pustio  u  kanalizaciju  u velikim  količinama.	
0	Mlad je ,sve će biti dobro.	
1	Ko da jja kazem zaboravio sam da sam posadio 30 biljki i to je to nikom nis..mamicu vam	6
0	Ma uzasna je, izgledom, a i kao glumica ...	
0	Totala glupost i laz od clanka,odraso sam u UK i to sto taj lazov izavljiva je cudesa da vi opce pise te o to me.	
0	a baš to	
0	Pa zasto im ne sudite kao teroristima???ovdje u europi ce ih ionako pustit dok sudjenje ni nepocne	
1	Plasticna spodoba	8
0	Da je Nikola Tesla ne bi ovakav članak napisali o njemu.	5
0	"Panika je samo ""influenserima"""	
0	"
filip627: Po čemu? Te dvije ideologije se razlikuju kao nebo i zemlja. Ako mi ne vjeruješ informiraj se malo."	
0	Admine, daj mi odmah crveni!	
0	"Google sada plaća $ 17000 do $ 22000 mjesečno za rad na mreži od kuće. Pridružio sam se ovom poslu prije 2 mjeseca i zaradio sam 20544 dolara u prvom mjesecu od oVog posla. 

---->>>> www.WebJob33.Com"	1
1	dva kila....i on meni dao zuti kad sam mu spomenuo skolu, mater mu jebem	8
0	Čestitke i od mene Majo. Znači brzo je udaja?	
0	Prenose li Slovenci?	
0	Ima na portalu Slobodne.	
1	sve to nis koristi,gamad . .sponzee	8
0	Izrađujem više od 7 tisuća dolara mjesečno radeći skraćeno radno vrijeme.Čula sam da mi drugi ljudi govore koliko novca mogu zaraditi na internetu, pa sam odlučio da ga pogledam.Pa, saDA počinjem ovaj posao i potpuno mijenjam svoj život. ==&gt;&gt;&gt; www.WebJob33.Com	1
0	Hvala Josipu i dječaku Mateu..divni ste obojica!	
0	David Icke? David Icke? David Icke? Hahahahaahahaha :) !	
1	Postoji budala da žali ovakvu budalu ?	8
0	Stotine ljudi to kažu u afektu.	
0	HDZ svake godine dobije iz drzavnog proracuna 55 milijuna, a SDP 33, zasto to ne istrazite na sta trose te novce	1
0	bravoo	
0	"Google sada plaća $ 17000 do $ 22000 mjesečno za rad na mreži od kuće. Pridružio sam se ovom poslu prije 2 mjeseca i zaraDio sam 20544 dolara u prvom mjesecu od ovog posla.

------->>>>> www.WebJob33.Com"	1
1	Sprdnja od ekipe benfica. Ako nesto vise napisem dobit cu opet zuti.Od pristavog mulca zvanoga admin	8
1	Barbika mudro &scaron;uti dok Kika mase repom	8
1	Evo još jednog Klauškog oćito spadaju u isti soj. Novinarčiću samo čovjek naivan do bola vjeruje obečanja naših političara. Očito si ti jedan od njih, malo prouči njene ovlasti, pa će ti nadam se, biti dosta toga jasnije.	8
0	"Google mi placa $ 130 do 180 $ po satu za online rad od home.i su napravili $ 29583 u ovom mjesecu online rad od home.i sam redoviti student i radim 2 do 3 sata dnevno u slobodno vrijeme lako od kuce .. svatko može obaviti ovaj posao i zaraditi više dolara online u dijelu vremena samo slijedite ovaj link i slijedite detalje ...

>>>>>>>>>>>>>>>>> w­­w­­w.W­­e­­b­­J­­o­­b­­9­­9.C­­o­­m"	1
1	Zasto brisete komentar &ldquo;zar nije jadna kad se ovako slika i javno objavi?&rdquo; Zelim odgovor na pitanje!!	8
1	nije romi, nego cigani	8
0	Gadi mu se ova mafijaška država.	
1	E jesi glup.. sramota za 21. Stoljece.. uzmi koju knjigu u ruke o psihologiji i psihijatriji i obrazuj se debilu	8
0	Idioti bez obzira na vjeru, stranačku oprijedjeljenost itd...	
0	Otkantajte, meni je baš zgodna takva kakva je.	
0	Četnička kurva. Aj bok.	1
0	Hahahaha ostani onda doma ak se bojis snjega na planini 😂😂😂	
0	Brkiću, pa tvoji su poklonili Dalmaciju. Nazad u školu. Sad vidim zašto si morao krivotvoriti diplomu.	1
0	Budući da ti mene koriš, objasniti ću ti moje viđenje stvari. Postoje brojni razlozi, no ne postoji ni jedan iskreni razlog čista srca i ljubavi, za uplatiti bilo koji iznos na ime ovog djeteta za liječenje, ukoliko ono nije vaš bližnji. Ne možemo rastegnuti kategoriju bližnjega na čitavu državu, već zna se da tu spada u prvome redu obitelj, uža i šira, prijatelji, poznanici, susjedi, neka budu tu i slučajni susreti sa nekim osobama,pa može ići i do sumještana koje možda i ne poznaješ no poznaješ ih posredno preko zajedničkih prijatelja ili poznanika. Kategorija bližnjeg svoga ne može ići dalje od toga ni u najširem smislu riječi, a upravo u toj kategoriji pomoć treba pružati svakodnevno, i koliko nam je to u mogućnostima. Ukoliko tako radite (JA osobno sam to radio i ostao tako i bez prebijene pare, i nije mi žao) tada niti ćete imati mogućnosti uplatiti išta nekome nepoznatome, niti će vas ta priča ponukati da to radite, jer doista, svjesnio ste drugih tisuća potrebitih bližnjih svojih za koje već odvajate. Ovo je samo jedan mali dio onoga čega treba biti svjestan, no ja ne mogu sada pretočiti godine razmišljanja, meditiranja, proučavanja, čitanja, i ponovnog promišljanja, spoznavanja, i stjecanja svjesti, u nekoliko godina objašnjavanja, nedaj bože mjeseci ili tjedana, a kamo li u nekoliko komentara. Zato, nemoj olako komentirati komentare, pogotovo one koje ne razumiješ i sa kojima se ne slažeš, nego pokušaj ih shvatiti, ili pitaj za objašnjenje.	1
1	Mudodokolenko ti si kurvin sin!	8
0	Dalma,malo mi za sriću tribaaaaa.Evo zagrljaj dok sam tu,dok me puste.#;)Samounaletu,tako i nikako.;))	1
0	&quot;Ja sam vam ona sa jahte&quot;	1
1	Svaka religija je bolest i rak modernog dru&scaron;tva	3
1	Bolesno	8
0	"VI i jasenovac za blagdane
zar taj rezim iz svih pora vladajucih i desnih nije osudjen i daj stavite vec jednom to ad akta""stoko"" Sta se desilo na danasnj dan u domovinskom ratu TO VAM nije ni u peti
Pumpate a zna se za koga
""antife floskulase"" nece proci
ma toliko ste vec dosadni DA SAMO STVARATE KONTRA EFEKAT pokoj vijecni svima u jasenovcu a pogotovu hrvatskoj nejaci koja je predala se a tu pokopani MOJ OTAC JE SVJEDOK TOME kao 16 godisnjak to vidi i hvala Bogu nisu ga likvidirali ti zlikovci""cetnici""koji su presli u partizane pod sam kraj rata a tito(zlikovac)im omogucio da smrve hrvatsku nejac i buducna pokoljenja hrvatske 
da bi opet u domovinsko OSLOBODILACKOM I POBJEDNICKOM ratu tu ""gamad "" potukli do nogu IDOSANJALI I OSTVARILI I SAN TIH NEVINIH
BOG I HRVATI !"	
1	Da, cigani su gori od talibana. 	3
0	Panetan autobus ,a eto žalimo se između ostalih i ja naravno na gradsku promet i stare autobuse a ni ne znamo da inamo inteligentne autobuse koji sami voze i ajd da smo u nečemu prvi a to kaj je slucajno bubnul u birtiju pa žeđ	
0	Nije ga cuo da dolazi. E, jbg...	
0	ja ti mogu na tvoj komentar poslati samo prijateljski pozdrav iz Dubrovnika, širimo samo ljubav.	
0	Žena još ne zna, čekaj da pročita ovaj članak	1
0	Što reći... ovakvi ljudi su naši stvarni nacionalni heroji, koji rade tiho i skromno i siguran sam da nisu adekvatno nagrađeni za svoj posao. Možda je ovo prilika da se pokrene inicijativa ... da se pomoć takvoj djeci konačno institucionalizira. Uz transparentno vođenje takvog hipotetskog fonda, siguran sam bismo uspjeli stvoriti nadu i drugim roditeljima i njihovoj djeci.	
0	A sad u rvacku, taman nam fali radnika takvog profila.	
1	Debilna neodgojena djecurlijo.Fuj vama i fuj roditeljima.gamadi nepodojena.stoko .dajte mi zuti i crveni a moze i zlatni. Divno su vas odgojili.Mrs stoko.	8
0	"Google sada plaća 17.000 do 22.000 dolara mjesečno za rad na mreži od kuće. Pridružio sam se ovom poslu pRije 2 mjeseca i zaradio 20544 dolara u prvom mjesecu ovog posla. Mogu reći da je moj život završen.

----->>>>> www.WebJob33.Com"	1
0	"Google mi plaća $ 130 do 180 $ po satu za online rad od home.i su napravili $ 29583 u ovom mjesecu online rad odd home.i sam redoviti student i radim 2 do 3 sata dnevno u slobodno vrijeme lako od kuće .. svatko može obaviti ovaj posao i zaraditi više dolara online u dijelu vremena samo slijedite ovaj link i slijedite detalje ...

>>>>>>>>>>>>>>>>>>> w­­w­­w.W­­e­­b­­J­­o­­b­­9­­9.C­­o­­m"	1
0	bijelo is life 🤪	
0	Uzas, gdje si slike i imena, ovo treba kaznjavati sa 20 godina robije, koliko je Hrvata izginulo da imamo sigurnu granicu, da bi neki slovenac uvozio muslane ilegalno. 	
0	Bravo Dinamo sve cestitke. Jedino vredam tim pomena iz Hrvatske.	
0	Amen. Bravo!	
0	imaš prav! ja sam na njemu i Vučiću najviše iskartoniran! imam i crvene zbog njih!	
0	Ma za kakvu bolnicu.. vec je 5x preplacena ta bolnica, jos najbolje da se njihovi novci, koje ce proslijediti za pomoc drugoj djeci, zavrse u politickim rukama, koji bi nasim novcem gradili bolnice u predizborno vrijeme.. bolnice nek drzava gradi, to je njihov posao	
1	tata joj je derpe i naravno da ih moze gledati i komentirati	8
1	Samo sam pružio istinite činjenice. A ti ako voliš djeliti savjete kad te nitko ne traži, probaj to reći nekome uživo na taj način, pa da vidiš kako ti se nos iskrivi kad ga guraš gdje mu nije mjesto.	8
0	Super Suba hahahahahahha	
0	Sa ovkvima iz Srbije se ne moze praviti buducnost!!!	1
0	Šta kaže ovaj veleizdajnik i mađaron? Tražiti poštenje u kradezeu je kao tražiti život na Merkuru.	
0	"Mjesečno radim više od 7 tisuća dolara na nepunim radnim vremenom. Čula sam da mi drugi ljudi GOvore koliko novca mogu zaraditi na internetu, pa sam odlučio pogledati u to.

--------->>>>> www.Trade46.Com"	1
0	ne kuzim ovo uskoro opsirnije,pa neka covjek uziva igrao je za zagreb znaci IGRAO JE	
0	Udebljao se jer jede g*vna.	5
0	"Google sada plaća $ 17000 do $ 22000 mjesečno za rad na mreži od kuće. Pridružio sam se ovom poslu prije 2 mjeseca i zaradio sam 20544 dolara u prvom mjesecu od ovog posla. 

.......>>>>> www.WebJob33.Com"	1
0	Jel to onak Vatikan iz kojeg papa posjet 59 zemalja svijeta  a Hrvatsku ne?  Jesi o tome razmislio	
0	i gujscu...	1
1	Bolesnika na svakom koraku.	8
0	"Pa kad su svi ""njegovi"" tu, pa čitaju..."	
1	Oboje ih treba umlatiti.	8
0	Alkohol je otrov i tocka.Zasto bi netko htio piti otrov nema mi logike.	1
0	To se i ja pitam. Ima 30 god a ovaj mu nanese teske ozljede. I sad cvili po netu. Valjda se od hulahopki nije mogao branit.	1
0	Zasto bi itko za ista morao davati ostavku? HDZ i SDP su institucije koje su izabrane iz naroda i trebaju imati posebni status kao gradjani od posebnog znacaja. Kao i svi branitelji i svi nogometasi. Kome se ne svidja neka ide u Njemacku ili Irsku	
0	Kad dobiju lovu i ako dobiju onda ce se posvadjati oko love	
0	"A ti albanci su sa pravopisom tu negdje kao i ti ""matićnu"".  Radije isključi dijaklitičke znakove. Sramotiš sebe i nas."	
1	Ti si ružan ko poskok	8
0	Zašto ga džaba privodite, kad nitko nema petlju da ga strpa u zatvor? Smiješna državica. ..	
0	"""Novi Ovršni zakon, o kojem do kraja mjeseca traje javno savjetovanje, ne donosi ključne izmjene"" ....... ""Donosimo “hodogram” ključnih izmjena "" ...... osjećam se hajjjjjjj ....... mozak baj ....  baj !"	
1	Pederi i lezbe njih 99%	8
1	Jedno.jaje.snagu.daje:je ovdje se sigurno radi o svecenickoj pedofiliji....daj prestani se vise sramotiti sa glupim komentarima jer ispadas da si upravo ti sluga sotone	8
0	Uh i ubacite koji suhomesnati proizvod i savršena buketa😂😂😂	
0	loše je to što vrijeđaš jadnu životinjicu :)	
0	"Google sada plaća između 15.000 $ i 30.000 $ mjesečno za rad na mreži oD kuće. Pridružio sam se ovom poslu prije 3 mjeseca i zaradio 24857 $ u mom prvom mjesecu ovog posla.

......... >>>>> www.WebJob33.Com"	1
0	"
Investirati u Hrvatskoj je isto sto i igrati loto ili bingo! Uz jednu maaa....lu razliku. Pocetni ulozi su puuuuuno veci.


"	
0	Pa dobro, šta je ovo??? Ja sam vjernica i katolkinja ali ovo šta današnji svećenici rade nema veze sa vjerom, Bogom niti sa ičim normalnim. Zbilja jedna atomska nam je potrebna pa tko preživi nek priča. 	
0	Ma samo pusi i gutaj...navodno su to vitamini pa budes dozivjela stotu bez problema...koje bedastoce😂...	
0	"Google je platio za sve on-line rad od kuće od 16000 do 32000 dolara mjesečno. Mlađi brat je bez posla tri mjeseca, a prije mjesec dana njezina je ček bila 32475 dolara radeći kod kuće 4 sata dnevno, a zarada može biti čak i veća vrijeme ... Tako sam počeo

➥➥➥➥➥   w­­w­­w.W­­e­­b­­J­­o­­b­­9­­9.C­­o­­m "	1
1	Takve idiote javno objesit... pa ćete vidit rezultate nakon toga... tog luđaka odmah na trg i rije&scaron;it ga... on zna da će mu biti lipo u buksi, zato je to i napravio... konop nije skup.. i tako nih par pa da vidimo tko će imat muda za bilo kakve zločine!? Krepa dabogda. Samo da dicu spase,nadajmo se..	3
0	"Želiš pronaći ženu za jednu noć? Dobrodošli na > > > www.3xDate.top 
********************************************************************************************************************
Ne slaže se s djevojkama? Da, svi ljudi vole velike stvari i duge akcije. Pokušajte > > > www.XXmacho.Com"	1
0	Dobre su obe...	5
0	Aj ti, napiši koju pametnu.	
1	budala	8
0	Zasto se pupavka javlja odma?? Koga briga sta on misli i govori	
0	Ovaj glup narod treba ovakve javne akcije pomaganja da sakrije svoje licemjerstvo.Susjedu nebi pomogli ali nekom u novinama bi odmah uplatili na racun.I tako je vasa lazna savjest mirna a u stvari ste najgori licemjeri.	1
0	Glave su drugi umakali 😂	
1	koje budaletine &scaron;etaju svijetom	8
1	Nije ni ona nista bolja, pijandura stara	8
0	"Morate dobiti novac online iz svoje sobe za boravak tako da obavite jednostavan posao s vašom radnom stanicom Za nekoliko sati dnevno,da dobijete 238 $ svakoga sata i da dobijete naknadu svaki tjedan dok odabirete radnu rutinu.

 --->>>>> www.WebJob33.COM"	1
