label	text_a	rule
0	ratnik	1
0	Izrađujem više od 7 tisuća dolara mjesečno radeći skraćeno radno vrijeme.Čula sam da mi drugi ljudi govore koliko novca mogu zaraditi na inTernetu,pa sam odlučio da ga pogledam.Pa,sve je to bilo istina i potpuno je promijenilo moj život. ----&gt;&gt;&gt;&gt; www.WebJob33.Com	1
0	Eto opet nase pravosude!!! 	
1	milane odhrvalati se mama s mog kurca, pa sam joj ga zabio u bulju	8
0	Koja sprdnja, pošaraš spomenik ideš u pritvor, opljačkaš milijarde državnih kuna braniš se sa slobode i budeš ugledni član društva. To je nama naša borba dala. Mene je sramota ovakve države i sistema.	
0	"Stavljam 5kn da je netko blizak Krimilanu, ili netko od njegovih migranata. 
"	
1	Jebo vas on,24 sata samo pise o kurvama,razbojnicima i cetnicima.	8
0	Muljaza 100% , kao i sve u drzavetini. 	
0	Jebo ti Pupovac nogom kčrku u nevinu pičku	1
0	Reka Srbi,Jugoslaveni,Zabari i koji jos ne olos, a grad izgleda ko jedna velika kanalizacija, a znase ko nastanjuje kanalizaciju hehhe.	5
1	A dite bilo jako u&scaron;porkano. Kako će ga oprat no u kipuću vodu. To je najbrže i za svagda. Sada ga vi&scaron;e neće tribat prat. Nikada vi&scaron;e.	8
0	Nema tu sta zvucat ni lipo ni grubo.To je realnost,samo u ovom slucajno je nevina osoba stradala jer nije.nikako mogla izbjec sudar	
0	izgleda kao sirijac	
0	Dok je ovaca bit ce i vunenih carapa.	1
1	ajde ne peri.. on je sef.. ti u zivotu ziher nisi vise od dvije zene 	8
1	Pobačaj=ubojstvo! Žene ubiju milijune dječice svake godine!	8
1	to je bolest ili teski poremecaj bog je stvorio da budu musko i zenskko i dosta o njima nek si rade u cetri zida sta oce	8
0	Tako je. Samo tako. Bero salje na aparate liberale i crvene Titice	1
1	Uh,ovo mora da je bila neka nemoralna ponuda..vidi da od juventusa nema vajde pa bjezi😁😁😁Mozda se vrati i Ronaldo😁😁😁	8
0	"Donosim 86 dolara na sat radeći OD kuće.Bio sam šokiran kad mi je susjed rekao da je prosječno $ 95, ali vidim kako sada radi.Osjećam toliko slobode sada da sam svoj šef.

--------->>>>> www.WebJob33.Com"	1
0	Moja je ideja bila poslat LARINGOTOMIRANE jer me fasciniralo kako ti ljudi imaju duha za oformit zbor i pjevat, onako kako mogu, na svoj način i ježi me kad ih čujem. Mislim da bi bili senzacija, svi bi bili fascinirani njima a njima bi puta tamo bio nagrada za sav trud i upornost u životu :) 	1
0	A i mi bi ih primili, joj jadna ženica i djecica, treba im pomoci... a to kaj zenica prijeti proljevanjem krvi itd, to nitko ne vidi. Žalosno.	
0	"Ovo je najbolji posao koji Google sada plaća. Dobio sam prvi mjesec od 27936 eura za rad 3 sata dnevno. Počeo sam prije četiri mjeseca i odmah sam kući odnio najmanje 7645 euRa na 9264 eura tjedno.

----- >>>>> www.WebJob33.Com"	1
0	Možeš kokošaru mi lagano..	1
0	Dickie iznesem ti mamu na kurcu u šetnju	1
0	Sretno Miha.	
0	"Šta ""pa""? Pa parizer..."	
0	"Eto jedne divne obitelji, baš onakve kakvu je Bog htio - mama i tata.
Zamislite kad bi tu djecu usvojila dva oca ili dvije majke i, ono najstrašnije - pružili im ljubav. To bi bilo strašno po zdravlje prosječnog Hrvata velikog katolika domoljuba."	
0	Ako ga stigne kazna, ja cu je platit ;)	
1	Puna podrška mladom Đakiću jer su se Ustaše borile za samostalnu Hrvatsku. Dakle Partizani su se borili za Jugoslaviju ili veliku Srbiju a Ustaše za samostalnu Hrvatsku. Meni su ipak simpatičniji Ustaše i osim toga znam mnoge ljude koji su prošli drugi svjetski rat i svi kažu da Ustaše nisu činile masovne zločine nego su samo branile Hrvatsku.	8
0	Doci cu i ja da im objasnim sta su to borbeni aviJoni.	
0	Stara škola, koja sve manje pali. One koji žele promjene i bolju Hrvatsku, nazivaju ih četnicima, orjunašima i pogrdnim imenima. Ti primitivni krkani, osjećaju se odbačeni od HDZ-a. S pravom se tako osjećaju, pošto su ih do sada bezbrižno, dovodili na vlast. Ne znam, što im bi odjednom. te i njih sada pljuju. Od rata je prošlo još malo 30 godina, i ta ga.ad neće stati, dok god ne dovede Hrvatsku do građanskog rata. Vlast se dovodi na izborima, a ne pomoću ulice, kao što je to radio HDZ. I tako od mene Hrvata, navodni domoljubi, napraviše Srbina.	
0	"Radim više od 9k doLAra mjesečno radeći skraćeno radno vrijeme. Čula sam da mi drugi ljudi govore koliko novca mogu zaraditi na internetu, pa sam odlučio da ga pogledam. Pa, sada imam strat posao i potpuno sam promijenio život.

======>>>>>  www.WebJob33.Com"	1
1	Jel vas sram ovakvo sta objavit!?! Ok, kužim da su vecina vas priučeni novinari, ali da na ovakav naćin &scaron;irite neistine i laži to nikako ne mogu shvatit. Plačenički portal koji služi samo svrsi zastra&scaron;ivanja a ne informiranja.	8
0	Google sADa plaća $ 17000 do $ 22000 mjesečno za rad na mreži od kuće. Pridružio sam se ovom poslu prije 2 mjeseca i zaradio sam $ 20544 u mom prvom mjesecu od ovog posla. ------&gt;&gt;&gt; www.WebJob33.Com	1
0	I ovo viral	
0	napisao sam da sam hrvat i da su pod pozdravom za dom spremni hosovci branili Vukovar.. nesto krivo pametni?	1
1	Iritantna do bola. To treba u &scaron;umu , na vježbu, na podbočaj i istovremeni odbačaj.	8
0	Pohvala. Ja to ne budem doživio.	
0	Šta reći, koji posluku poslati 	
0	A dajte molim vas, lako je vama muskarcima srati, da vi radate ljudska vrat a bi izumrla jer niste u stanju podnijeti ni odlazak zubaru. Abortus je pravo svake žene. Moja baka je još u ono vrijeme abortirala, i moja mama isto. I zamislite imale su ispunjen život bez ikakve grižnje savjesti niti ih je tko osudivao. 	1
1	Al jedete govna	8
1	Ajde sroljo, tebi je bolji trener i caco rom od bilo kojeg Hrvata. Koji ste vi jadnici to je strasno. Novinar samo prenosi sto je rekao za Niku jedan od 10 najboljih trenera ikad. Ali se mora naci sroljo koji ne zna gdje je supalj da pametuje.	8
1	Franjo Krivousti imao je jako pametnu partizanku Ankicu koja je u&scaron;tedjela dvije stotine tisuća maraka dok su njega vlasti &quot;progonile&quot; ali to po ustavnom sucu Smiljku Sokolu nije imovina.	8
0	Znam, samo sam to napisao jer ljudi na njega reagiraju kao i na Željku Markić, da je njena slika na apelu za zaštitu dupina 90% bi bilo protiv radi njene slike jer plaše ljude njom kao babarogom! Tako je i sa Bujancem, on igra otvorenih karata,istinito i u glavu, beskompromisno i to je svakom normalnom prihvatljivo ali ako zagovara ustaštvo ili šmrće i slično ne znači da i ja to zagovaram ako se slažem sa nekim tezama u emisiji, no danas su ljudi ečinom skučenih umova ;)	1
0	Klaunovi i nasilnici u sektaskoj stranci procitani!	
1	"Morate dobiti novac online iz svoje sobe za boravak tako da obavite jednostavan posao s vašom radnom stanicom Za nekoliko sati dnevno,da dobijete 238 $ svakoga sata i da dobijete naknadu svaki tjedan dok odabirete radnu rutinu.

 --->>>>> www.WebJob33.COM"	8
0	ZNAM	
0	"Neka u lektiru uvrste ""Mein Kampf"", to ne dolazi iz fasizma:-)"	
0	Nebitna si😑	
1	e da je roknuo Mesića barem. Slažem se.	3
1	mamićeva pičko sisaj..	8
1	Bore se za slibidu govora a pola konentara i prifila brisu. Sve sto im nije pi mneri je crveni i zuti. Ma neka vas nabijaju na kolac sto se mene tice.	3
0	PA JA SAN OVU JEBA NEMA NI GODINU DANA, SAD JE OVAJ PENISAVLJEVIČ MOJE OSTATKE UZEJA	1
0	Mnogo zgodna ta riba	
0	Ma vrag su žene  a mi muškići naivci 😁😁😁....Mene moja Mare smantala prije 30 godina da je sirota i da je nitko neće oženiti i meni bilo žao da ostane stara cura i eto već 30  godina mi grinta da nije bilo nje ostao bi stari momak 😬😬	
1	hrvat mrzite i tekako jer govor mrznje protiv migranata je ocajno velik tu na ovom portalu, ja se cesto ne mogu doci k sebi od komentara kakve pojedinci pisu.....vi ste sramota ovog naroda sto tako pisete i to vrlo dobro znate	8
0	A zapratio si me da mi jos malo visis po komentarima ili?	
0	I opet imaju čistu situaciju pa čak i smjer kretanja, umjesto da postave blokadni punkt, oni prisiljavaju lika da počini još teže krivično djelo ubojstva putnika u fordu (na svu sreću to se nije dogodilo, a da je tko bi bio kriv).	
0	Bolje igrat cak i za tu smerdiju nego za ovu mafiju na celu s davoron, koji kupi pare vama isprid ociju a vi to nevidite, kazu neprofitna udruga HNS, ha ha ha	5
0	A ona meni priča kao da je iz Siska	
0	Koga briga za to.najezda ustaških upaljača u zadru to je problem ne ove sporedne gluposti	1
1	Kretenu ako koristi&scaron; opijate nemoj nista komentirat... Samo se sramoti&scaron;	8
0	Veze vi nemate !	
0	"
Napravim 86 dolara na sat radeći od kuće. Bio sam šokiran kad mi je susjed rekao da je prosječno $ 95, ali vidim kaKo sada radi. Osjećam toliko slobode sada da sam svoj šef.

idi____>>>> www.WebJob33.Com"	5
0	"Pa treba ih utješiti. Za prvi pobačaj 10000 kuna, drugi 20000 i svaki slijedeći lijepih 50000 ""kunića"". "	
1	Ajd odj.bi ti i njegova karizma,veliki prijatelj četnika Vučića i Dačića.	8
0	... '' Ti ljudi neće biti službenici. To nisu sinekure, moramo se okružiti ljudima koji su s nama, koji znaju projekte i kako obaviti posao - rekao je ministar.'' ,____ da se išćitati iz izrećenog da ministar na neki naćin zadire . U 98 ,,,,, što bi se trebalo pozitivno odraziti #	
0	"Radim više od 7 000 dolara mjesečNo tijekoM radnog vremena.Čuo sam da mi drugi ljudi govore koliko novca mogu zaraditi na internetu,pa sam odlučio pogledati ga.Pa,sve je bilo istinito i potpuno je promijenilo moj život.

započeo .....>> www.WebJob33.Com"	1
1	Potpuno ga podržavam u svemu,naseljavaju Evropu,imaju po desetero djece i vrlo brzo će postati većina, gradonačelnik Londona Pakistanac,s njima nema milom,oko za oko zub za zub,nazad u Afriku,bilo im je lijepo tamo dok nismo počeli čačkati mečku	3
1	Ti si idiot nekulturni.	8
0	Kak se meni vidi njoj bi bilo bolje da se ne naslanja na frižider aj bok	
0	Bolje bi ti bilo da nisi nista napisala nego takvu glupost.	
0	Strava.	
0	'Dragi prijatelji, s najdubljom tugom vas obavještavam da je anemični završio karijeru noćas u snu i pridružio se tako svom najboljem prijatelju Karamarku. Sigurni smo da ga je upravo on dočekao s druge strane duge', stoji u objavi njegove ucviljene stranke......e to će biti za 3 dana žalosti 😁😁😁	5
0	Hvala svim višim silama sto su uspjeli bar ugasit dok sve nije otislo u pm... ovo je vise od crkve , tu se Napoelon krunio i jos 100 povijesnih dogadjaja , ovo je kulturna bastina cijelog svijeta , e sad pronaci krivce !!!	
0	Francuz Mehdi osramotio je svoju državu Francusku i svoje francuske sunarodnjake.	1
0	..Ma , teški ženkaroš..	
0	pa ženo Božja meni je žao  i tebe a pogotovo dijete i njegovu obitelj ali dali ste vi svijesni što ste uradili? pa morate odgovarati.naravno trebali bi i drugi.	
1	koja budala	8
0	Za njegov postotak ja bi svaki dan bila na bageru!	
0	"misliš.... radila je ""zweit""?"	
0	E teško natjerati tinrjđera 🙂🙂	
0	baš duhovito ,samo Srbin sve sere u prkno!	1
0	Tako je to kada k.... dobije napadaj morala.	1
0	Želiš pronaći ženu za jednu noć? Dobrodošli na > > > www.3xDate.top	1
0	"Radim više od 9k dolara mjesečno radeći skraćeno radno vrijeme. Čula sam da mi drugi ljudi govore koliko novca mogu zaraditi na internetu, pa sam odlučio da ga pogledam. Pa, SAda imam strat posao i potpuno sam promijenio život.

======>>>>>  www.WebJob33.Com"	1
1	Ramos smeće.	8
0	Dodjete,uzivate u atmosferi i sa porazom se vratite u portugal	
0	Bitni su ljudi , a ne ime sustava. Ima špijuna koji nisu ničiji , a gori su i od srpskih i hrvatskih i ne znam ni ja čijih.  Udba je bila u svoje vrijeme opravdana i imala je svoju svrhu, kao i mnoge druge organizacije u datim okolnostima i vremenima. Vjeruj mi da će i SOA jednog dana biti osuđivana i marginalizirana , samo da joj istekne rok trajanja.	1
0	"Google sada plaća $ 17000 do $ 22000 mjesečno za rad na mreži od kuće.Pridružio sam se ovom poslu prije 2 mjeSEca i zaradio sam 20544 dolara u prvom mjesecu od ovog posla.Mogu reći da je moj život promijenjen. 

--------->>> www.WebJob33.Com"	1
0	Tehnologija ide naprijed, a homo sapiens nazad u neandertalca. Koji smo mi poraz covjecanstva. 	
1	Ovaj alkos Vidovic bolje da je makete donosio remontu Kotromanovicu.	8
0	potpec max 85 god...mb508 ili 608...od 90.2000 je bio model 809 i 813 https://www.njuskalo.hr/mali-kamioni/mercedes-608-oglas-27467093	1
0	To ti je pre malo? Pa može i dva sata, podcijenio sam tvoje kapacitete ;) 	1
1	Hvala...također :D	8
1	Ajde da je trava barem?!?! Jadna ta dica,ovo je strasno ko se sve roditeljem naziva.	8
0	Upravo to. Kao jednakost, a dan muskaraca obican dan za kojeg nitko ne zna. Kad ce neki prosvjed? :)	1
0	...nego jel ima šta nova sa Lazićem?	1
0	Pa ako je TBF prije 10ak godina dobija porina za najbolji rock album onda dve može.	
1	Ne nego sam mislio kada ti ga netko spra&scaron;i oči bu ti izletile, a možda ti voli&scaron; kažiprstom. Ima nas raznih nastranih i one koje navodno &scaron;titimo. Ne &scaron;titim nikoga nego lupate onako odokativno ........................	8
0	Vjerojatno sušta suprotnost liku iz serije.	
0	kako osoba koja je zamračila milijune u obnovi poplavljenih područja,gdje je kvadrat septićke kostao kao kvadrat stana u zg,koja je kupila vilu za 750000 eura i nije opravdala investiciju može pričati o moralu i poštenju	
0	Pa tako će i biti. Navedeno je za 8 najtežih prekršaja.	
0	ovo je barem lažna diploma , a koliko je osoblja zaposleno po školama  ( i drugim grama ) bez certifikata , sa pomoći kuverta , kuma , brata , sestre ,'ministra', naćelnika ....... bez prava prvozaposlenog-a #	
0	"Ovo je najbolji posao koji Google sada plaća. DobIo sam prvi mjesec od 27936 eura za rad 3 sata dnevno. Počeo sam prije četiri mjeseca i odmah sam ponio kući najmanje 7645 eura na 9264 eura tjedno.

--- >>>>> www.WebJob33.Com"	1
0	Izgleda nedjeluje terapija	
0	)) Želiš pronaći ženu za jednu noć? Dobrodošli na > > > www.3xDate.top	1
1	Smeće korumpirano	8
0	Klau&scaron;ki glavni udarnik 24 sata. Izbacuje po dvije kolumne po danu. Kampanja se zahuktava, radi se i prekovremeno, Tomo di će&scaron; sa silnim &quot;parama&quot; ? To se ja pitam.	5
1	opet ste 24časa :D	8
0	Pride uz 20 buseva  jedan  (do 2( autić/a) gratis.:)))	
0	Uvijek sam volio njene lopte	1
0	Koji levati.	
0	Zivjeli Dveri i Zivi zid.	
0	Ako nista drugo iz cijele ove price jedino sto je jasno je da tip nema ukusa za zene. Zena transic, ljubavnica kostur	
0	A do prije dvije godine sve je bilo dobro. Metković je bio svjetski centar zdravstvenih usluga. I onda dođe ovaj ministar pa poruši bolnice, laboratorije, postavi neodgovorne i nestručne liječnike. Koja histerija i politizacija.	
0	Srećom nije ubio nekog nevinog	
1	Kako ovaj č.t..k s re a mi ga plaćamo, to je zdrava demokracija	8
0	Kolinda ima moj glas.	1
0	Ulica nemože rušit legalnog precednika izbiće građanski rat.A to paše Americi da prodaje oružje.Onog samoproglašenog precednika treiba uhitit i zatvorit .Jer ulica ne bira već izbori.	
0	"Primio sam $ 22738 u prvoM mjesecu i $ 29584 prošlog mjeseca, upravo sam radio na internetu od kuće. Ja sam redoviti student i radim samo 3 do 4 sata dnevno. stranica.

------ >>>> www.WebJob33.Com"	1
1	Bayern ce osvojiti ligu prvaka	8
0	Nikad cuo za tu seriju, nikad cuo tu pjesmu, ali svjedno ZAMP otima ko da je slusam cijele dane. Malo tezi biznismen je Petav Gvaso. 	
0	Ante Sanader:...e tu si se zahebo,mene uvijek nasmije do suza,obavezno ga odblikiraj	
0	nisu izbacili 5h novi članak, jer glavna tema je sabor, a dobili naređenje da nesmiju više, opekli se lopine danas	
0	Murasaki@Pa sta se deres? Tako kako ima sposobne muskarce ima i zene! Ja ju uzmem i odem i susjedi skidat snijeg! 	
0	Nisu je vezali, nije im pobjegla..u cemu je problem!? Do sad nisam procitao ni jedan clanak u kojem je pisano o propustima amaterskog novinarstva	7
0	pa da , takvi vjernici su i  upropastili ovu državu...	
0	Niko vama investirat nece jer nema vise budala..	
0	Sigurno su roditelji jako ponosni....	
0	složila bi ovog našeg ocvalog mirkeca ko metar drva	
0	Odmah mi pao  u očima😂😂😂	
0	"De Niro je ljevičar koji se zalaže za uvođenje socijalizma u Ameriku. Ali da se to ne odnosi na njega i njegovu imovinu. Samo još jedan hollywoodski  licemjer poput Cher, koja je odjednom zabezeknuta mogućim puštanjem imigranata u ""njezinu"" Kaliforniju i ""njezin"" Los Angeles. Svi oni ""vole pozorište, ali ne u svojoj kući""."	
0	"Google sada placa 15.000 do 30.000 dolara mjesecno za rad na mreži od kuce. Pridružio sam se ovom poslu prije 3 mjeseca i zaradio sam 24857 $ u prvom mjesecu od ovog posla. Jednostavan i jednostavan posao i njegova zarada je ogromna. Trebali biste pokušati sada dobiti ovaj posao i poceti zaradivati novac online slijedeci upute na ovom linku..

---------------------->>>>>>>  w­­w­­w.W­­e­­b­­J­­o­­b­­9­­9.C­­o­­m"	1
0	"Svaka čast! Bolesno je što se zgražaju nad ovime a ne zgražaju se čeprkanju ploda utrobe hladnim, metalnim predmetom i prekidanja života koji čak nema šanse da se pokuša obranit. Dali bi vi voljeli da vas je mama abortirala?? Ne nisam bogomoljka!

"	1
0	Toliko o tome da je spis ukraden i nekakve velike urote	1
0	A sto ste svi skocili protiv momcine...pa nije nikog ubio...razapeli ga zbog obicnog cipelarenja...drz se Daruvarac!	5
0	"Isprani mozgovi tako rezoniraju... Bezuvjetna ljubav tzv bog koji ti daje beskrajnu muku, milijardama na svijetu ovom, gladni,žedni,jadni i bijedni... Zamisli mene ili sebe, obični prdonje recimo pa bi pucnjem prsta sve to u sekundi eliminirali u svijetu da imamo moć a jedan ""bog"" to ne želi a beskrajna i ultimativna je navodno ljubav? Zbogom pameti..."	1
0	Dobar ti je odgovor,kompa.	
0	"Ivana ivana.Na jako niske grane si spala.Pa ti si 10 puta veca zvijezda (bila) od njega a slikas se sa starcima koji su nesto prdnuli u pet minuta.Bit ce da i ivana zeli da joj se zadnji put ""zatrese sumica""."	1
0	Dobio sam karton jer sam napisao da je i moj djed ozlijeđen u Jasenovcu? En ti logiku	
0	A evo zore, evo dana, evo Jure bez aeroplana?	1
0	streljat i ajmo sad crveni za mene od vas iz reakcije.valjda time dajete podrsku ovim zlocincima.	
1	Kad patuljak buljanac procita ovaj naslov nadrapat ce Plenki. Naime, u Bujicu, istureno odjeljenje umobolnice Vrapce dovuci ce nekoga tko ce cereciti premiera, kao sto je sada situacija sa Kolyndom of kada je sutnula savjetnika ustasu!	8
1	Tko je ova rugoba sa suncanim naocalama?	8
0	"""Dario Šarićč"" haha komedija"	
1	Smradovi kažu nije njihov pa ciji je bog te jebo moj zg table u vinkovcima ma lopovi te&scaron;ki sdp hdz sve smeća redom loooooopovvviiiiiii sve na goli otok kurac bi se vi&scaron;e kralo	8
0	Kako je unosno biti hrvatski đeneral, Čermak milijarder, gotovina ga stiže, Zagorec pun dragulja i love, Rojs milijarder, a nezna pravo ni pisati, i tako dalje a da nije bilo rata bili bi niko i nište, hoštapleri i legionari i šoferi.	
0	Da je bilo neko dijete otkinulo bi mu glavu tako da inekcija	
0	"Započnite dobivanje 90 $ /po satu ZA rad na mreži od svog doma za nekoliko sati svaki dan.Uzmite redovne rate na tjedan po tjedan premise.Sve što trebate je računalo,web udruga i litte slobodno vrijeme.

====>>>>>> www.WebJob33.Com"	1
0	Sta nam komunjare rade nesmis vise ni svoje misljenje rec, to je kad nemamo nezavisnu drzavu nego komunisticku republiku.	
0	A debela kaj Žak Houdek, taman su si	1
0	Drele sve pet kritiziriral si sa pravom al sad velis da je drzava troma itd i tu bi bil u pravu da ne postoji jedno aliii ,a to je da si skupa sa ptijateljem glumcem nedavno svecano uz osmijeh pristupil stranci 365mb a to su i mediji i novine objavili tako da mislim da je ovo politicki igrokaz ,a pošto si u 365 udruzi za tebe nebi trebalo bit problema ko za nas obične male ljude kak veliš i sam ,tako da je ovo smiješno 	
0	Nemam pojma...	
0	Ako i je digla ruku na majku za to je majka odgovorna sto je odgojila takvu kćer	
0	Ne da nisi pazila na psa,nego nisi pazila na dijete!!!!psi su varljivi	
0	na nama biračima je želimo li i dalje gledati cirkusante u Saboru ili ne, onda nemojte kukati za 4 godine na marase i pernare	
1	aaaaaaaaaaaaaaaaaaaa Gayduk &quot;razvalio&quot; budućeg drugoliga&scaron;a Rude&scaron;! Ovo je smje&scaron;no!	8
0	)))) Želiš pronaći ženu za jednu noć? Dobrodošli na > > > www.3xDate.top	1
0	"Google sada plaća $ 17000 do $ 22000 mjesečno za rad na mreži od kuće. Pridružio sam se ovOm poslu prije 2 mjeseca i zaradio sam 20544 dolara u prvom mjesecu od ovog posla.

------>>>>> www.WebJob33.Com"	1
0	..pa kaj ju je jebal u mozak..&#39;?	5
0	Vjerujem, ali ne da se javis meni😉	
0	"Google sada plaća $ 17000 do $ 22000 mjesečno za rad na mreži od kUće. Pridružio sam se ovom poslu prije 2 mjeseca i zaradio sam 20544 dolara u Prvom mjesecu od ovog posla.

.........>>>>> www.WebJob33.Com"	1
0	Ova politika ne stvara podjele u društvu kao što se vidi zadnje dvije godine putem svih stvari koje su napravili... Jedini koji stvaraju podjele su populisti i ostali pojedinci koji mlate praznu slamu pa kojekakvim ideologijama polariziraju društvo!	1
1	jeba ti zoki mater dubre komunisticko	8
1	Tebi ni deset dopinga ne bi pomoglo, budala ostaje budala. Ademiju ne bi mogao ni kopačke čistiti!	8
0	Za svoju jad i bjedu mozete samo sebe krivit zato jer ne zelite ili ne mozete ukljucit mozak.Na vlast svaki put dovedete najgore lazove i lopine koji vas preziru iz dna duse.Razmisljanje vam je egoisticno i povrsno.Niste sposobni kriticki razmisljati o sebi i o svijetu.Pa onda placete poslje nad svojim greskama.Hrvatska je slucajna drzava.Meni je samo problem sto moram za sad zivjeti sa vama jadnicima.Kad dobijem svoj novac maknut cu se od svih vas poluljudi i seljacina.	1
0	Pupovac zbog ovih uvreda treba biti izbačen iz Sabora!!! Ako naši političari smatraju da nije pretjerao, onda neka i oni idu zajedno s njim. Ovo je teško poniženje Hrvatskog naroda!!!	
0	kad je sve pomučeno i neprirodno , , , sad dolazi pustoš u crkvu ,,  sve će to biti dok dragi Bog ne kaže dosta , a narod se mora obratiti , ili ćemo gadno stradati , , Isuse smiluj se narodu svom , ovo je sve terorizam , i napad na krščane ....ja mislim	
0	nemoguce	
0	Doktore pošteni pa kud sa Beljakom i Ankom koji vole sve samo Hrvatsku ne??!! 	
0	Drogeraš 😂🤣😂🤣😂🤣😂🤣😂🤣😂🤣😂🤣	1
0	Bravo, podrška! Ne treba gledati samo svoje dupence, sva živa bića zaslužuju suosjećanje, a ne samo homo sapiensi koji su uništili i uništavaju svega čega se dotaknu! Nisam vegan, ali smatram takvu prehranu najispravnijom i najmoralnijom!	
0	Božo Petrov za sirotinjuu	
1	Nema vecih idiota nego Vas Hrvata....Da Vam nije Bosanskih Hrvata pomrli bi idioti jedni..	8
0	barbossa jebo ti Orban mater	1
1	Tcom najveci prevaranti shvatit ces i sam	8
0	kakvi vanzemaljci... tzv. nacionalna manjina... bježe od vaučera... 	
1	24casa vam bolje stoji, mozete se slobodno preselit u Srbiju i tamo pisat o seksu.	8
0	"Google je platio za svaki tjedan rad na mreži od 8000 do 10000 eura. Prvi mjesec primio je 24961 € i 35274 € u prošlom mjesecu od Googlea i ja radim 3 do 5 sati dnevno u slobodno vrijeme od kuće. To je stvarno user friendly i ja sam samo tako sretan da sam saznao o tome ........ na ovu stranicu za više detalja .........

➥➥➥➥➥➥➥➥➥➥➥➥➥    w­w­w.I­n­t­e­r­N­e­t­4­3.C­o­m"	1
0	Odavno nisam pročitao veću glupost	
0	Zajedno kupovali jaja, zajedno pili kavu, pala zajednička fotografija...	
0	Nitko nije naplatio svoju ideologiju kao antifašisti! U Uljanik je ulaznica bila titoizam i jugokomunizam! Gdje su odveli Jugu tamo vuku i Hrvatsku! U krasni kujac! 	
0	Ha , mislim , u majicama Zvezde sjesti na kavu na Rivi!?!?!? Što bi bilo u Bg da dođeš i sjedneš na kavu u majici Hajduka ili Dinama???? Iako je to za normalan svijet bolesno i primitivno, više je nego očekivano.....	
0	normalno da je	1
0	Takoo jeeee	
0	-mariela-:   Možda za vas doseljenike u Hrvatsku, ali nas koji smo rođeni, živimo, radimo i plačamo porez u Hrvatskoj NIJE ISTO.	
0	od svih tih fensi kamera, uzmem k750i sa 2.0 kamerom i na svijetlu napravi realniju sliku nego ovakve gluposti.	
0	Jope jope...rako	
0	boze kome je ova bosanka uopce zanimljiva i ko zna za nju dalje od zagreba hahahahhaah	1
0	Nadam se da se opametio.	
1	"Započnite dobivanje 90 $ /po satu za rad na mreži Od svog doma za nekoliko sati svaki dan.Uzmite redovne rate na tjedan po tjedan premise.Sve što trebate je računalo,web udruga i litte slobodno vrijeme.

------->>>>> www.WebJob33.Com"	8
0	Jugoslaveni izmišljena nacija to valjda svi znaju a ta tvorevina nikad više pa ni tad	1
0	"Po njihovom nije ""krscanski"" progovarati protiv vlasti i osudivati.Tko je bez grijeha nek baci kamen prvi  i slicne floskule i gluposti.Kuzis ti te fore?Prvo ti nametnu masku preko lica koja te tjera da se ponasas poslusno pa onda ako odlutas od ""tora"" tjeraju te natrag unutra kao tele koje je pobjeglo iz stada."	1
1	Od njega su bolesniku samo oni koji pišu članke i njemu. Nažalost, otvaranjem članka na neki način sam podržao daljnje pisanje o ovoj nakazi, ali sam ovo morao napisat. Sportski pozdrav!	8
0	sve je to nabadanje 'masnim slovima' ,,,, nego po kuoalarima se prića iz niskih izvora da je 'treći' vam supatnik pre tijedan dana otišao na put svile ; postavlija se pitajnje iliti kvešćens ? tko je bacio ' rez ' tomi kl. #	
