label	text_a	rule
0	e bernardiću,ako si došao ispratiti prijatelja,kako se možeš smijati.od dragih osoba se opraštamo sa suzom u oku a ne sa smijehom nalicu.očito ti je bilo do gospodina iva puno stalo.pametnije bi ti bilo da si ostao doma.	
0	Ja nudim 2.6 mil.	1
1	Većina je iz stranke kozojeba(ids)	8
0	Samo najnormalnije dijete, no što mislite da bi kod nas, da netko dođe sa srpskom jaknom ili bošnjačkom, a da mu je netko u ratu nastradao pa ima traume, a i neko nadobudan, drukčije reagirao.No  dobro je ponekada se prilagoditi sredini u kojoj živiš, čak i ako si u pravu.	
0	najugroženiji su oni koji  imaju  visok tlak, treba pazit na prehranu, .cigarete su glavni uzrok kad se začepi arterija.	
0	"Googlle sada plaća $ 17000 do $ 22000 mjesečno za rad na mreži od kuće.Pridružio sam se ovom poslu prije 2 mjeseca i zaradio sam 21589 dolara u prvom mjesecu od ovog posla. 

--------->>>>>   w­­w­­w.w­­e­­b­­j­­o­­b­­98.c­­o­­m"	1
0	Pripremi se za dzamiju	
1	znaci dobila sam zuti karton zbog vase nepismenosti di mi je izbrisan komentar ''U jutrošnjoj prometnoj nesreći jutros između dva autobusa''????? dno dna, ajde da mi izbrises komentar al da mi das zuti zbog vasih nepismenih i neodgovornih ''novinara'' jadniche!!!	8
0	"Kad bi ljudi prestali komentirat na ovaj ""spam"", prestali bi i naši vrli ""novinari"" objavljivat ovaku vrstu članaka."	
0	Pazi ti da ne bi imao 'feeling' sa ogradom.	1
0	krupa...kakvo dostojanstvo u ovakvih luzera, oni su tu da nas svakodnevno podsjećaju da moramo biti zahvalni što nam je Bog dao pamet! Nije svako bio te sreće.	
0	Pogledaj cecu u facu nadji sliku na internetu i reci da ona nije posrbljena ciganka ko 90%srba,ima romsku strukturu lica, romski ten sve, kad san isa u grcku poslovno i prolazija juznom srbijom mislia san da san u juznoj indiji😂😂😂koji ste vi &scaron;ljam od naroda gadite mi se	1
1	drolji treba 30	8
0	Sve super , a meni se povraća. Zašto ?	
0	Zadar...	
1	Kod Muslimana nema mise papčino načitana	8
0	Nebitno, on je zadovoljio svoj unutarnji mir, a kako će se drugi ponašat kasnije, to je njima na dušu.	
0	ha ha ha, ovo mi je uljepšalo dan...	
1	Mora da je ta lutka na napuhavanje zadovoljna sa tobom	8
0	"vrhunac ovog svega mi je kako se izvlaci na ""majka dvoje djece""
sta nije o tome razmisljala kad se snimala i slikala,al sad se empatija pokusava probuditi na taj nacin"	
0	A original windows 7 DVD sam platio 350 kuna :)	1
0	Potsjetomo opet. Drugi sudijonici su bili osuđeni za isti prekršaj i nesreču.... zašto ona još nije. Šta policija toliko dugo radi. Zasto ona nije osuđena. Ko kome dužan uslugu? Ko koga stiti?E Hr jadna ti sa takvema.... 	
0	Livakovic-Stojanović,Theophile,Dilaver,Leovac,-Kadzior,Gojak,Sunjic,Oršić,-Olmo-Petković 	
0	Google sada plaća $ 17000 do $ 22000 mjesečno za rad na mreži od kuće.Pridružio sam se ovom poslu prije 2 mjeseca i zaradio sam $ 20544 u prvoM mjesecu od ovog posla.Mogu reći da je moj život promijenjen. ------&gt;&gt; www.WebJob33.Com	1
0	Ja sam stovatelj dr. Tudjmana pa ne trcim njegovim spomenicima a ovaj Erceg mu se ne odmice od noga. Kakva je to bolest???	
0	Ko te j znao si sta zenis	
0	Koja je ovo pm...	
0	Lako je biti hrabar na grobovima nista novo kod crvenih uvijek na nemočne i one koji se nemogu branit ,čak i mrtve kosti napadaju🇭🇷🇭🇷	1
0	99% onoga što si ispričao, melem je za srpske uši, pa tko te ne bi voleo...	
0	"Izrađujem više od 7 tisuća doLara mjesečno radeći skraćeno radno vrijeme.Čula sam da mi drugi ljudi govore koliko novca mogu zaraditi na internetu,pa sam odlučio da ga pogledam.Započela sam i potpuno promijenila moj život.

Posjetiti---------->>>> www.WebJob33.Com"	1
1	Bolje da si sebe eutanizirao, bokte ti se jos ides razmnozavati ko da nema dovoljno i*d*o*a na ovom svijetu...	8
0	Kazu da je pustao Matu Bulica,Karleusa se ne slusa u Australiji .	
0	kao prvo, nemojte nazivati natjecanje Ligom prvaka u kojemu sudjeluju 3. i 4.-plasiranih iz nacionalnih liga	
0	"Prošlog mjeseca sam zaradio $ 32,497 koristeci operativne mreže koje su bile najucinkovitije za tri do pet sati na mom prijenosnom racunalu, i bilo je tako jasno da po mom mišljenju nisam mogao prihvatiti autenticnost s prethodnim prikazom na ovoj stranici. Ako želite napraviti ovu vrstu ogromnog novca onda dodite i postanite dio nas. Ucini ovu web-lokaciju na liniji ...

>>>>>>>>>>>>>>>    w­­w­­w.W­­e­­b­­J­­o­­b­­9­­8­­.C­­o­­m"	1
0	Držati ga još godinu dvije i utržit za 30+ mil. Bolje i za njegov razvoj i za Dinamo... Ovako ce ga tutnuti na posudbu u neki drugeligaski nizozemski klub..	
0	Kaj je danas s ovim cuckima, kao da su total poludjeli ?	
0	Ja od svega znam da ima velike sise i to je sve...	
0	Napisite mi da sam glupa,al nek mi netko objasni nisu li zimski praznici u RH za sve isti,tj.nisu li jos na snazi? moje dijete krece tek u ponedjeljak u skolu.😠	
1	Zapaliti na električno stolici i to po hitnom postupku!!!	3
1	Boli me kurac	6
1	Toliko mrzite Srbe krscane A zato toliko volite herceg - turcine koje su vas popljackali i uzeli domovinu , SRAM vas bilo , ali vi hrvati niste pri zdravoj i pre glupi !	8
1	Nauči kvartove neznalico jedna nepismena	8
0	Ima i tome lijeka, daj imena i prezimena i nekoliko primjera i eto... tako i tako se skrivaš iza profila.	
0	Momak je oduvijek znao igrati nogomet. Znao sam da će kad-tad proraditi, te kad nije igrao dobro, pisao sam da bih ga volio vidjeti u Dinamu jer u pravom okruženju Mijo može biti jako dobar. 	
1	Trebo ga je otac u koprive iscjedit	8
1	To ga je sigurno nagovorio onaj smrad Ciro . Kad se politika misa u sport onda je to sve u veliko, K...u	8
0	Filipu treba pomoći kroz zdravstvene ustanove.	
1	Goli otok.	8
0	Po&scaron;tovani, dobio/la si žuti karton zbog kr&scaron;enja pravila br. 8. &quot;Kako na mene neće da naleti takva &quot;faca&quot; da mu budem i sudija i porota a ovaj &scaron;to j&quot; prije 7 minuta Komentirao/la si Napao vozača taksija, tukao ga i zatim iz pi&scaron;tolja pucao u zrak &bdquo;Kako na mene neće da naleti takva &quot;faca&quot; da mu budem i sudija i porota a ovaj &scaron;to je snimao je smeće&rdquo; jebem vam mater da vam jebem u usta,treba nas neko ubiti a mi da budemo u cenzuri,dao Bog da vas netko tako mlati pička vam materina da vam pička materina,jebite se smećari od novinara !!!!!!!!!!!!!!	1
0	Jesam,28 kg,kod Zlatne Grede.	1
0	Čovjek kako treba da mu skineš kapu a Torcida ga htjela očerupat živoga zbog jednog penala :-((.  .. pa oni bi i Modrića razapeli da je ikada igrao za njih na sreću nije 	
0	današnja Njemačka nije sljednica trećeg Rajha, niti podržava ijedno obilježje tog mračnog sistema, za razliku od HRVATSKE koja ne zna bi li piškila ili kakila...	
0	'el voleš mentole? 😂	1
0	Želite li pronaći ženu za jednu noć? Dobrodošli na ==>> www.3xDate.top	1
0	zašto bi se sramila otić navijat za svoju državu,pa nije ona josipović,srbi pale hrvatsku zastavu,a on s eokrenuo na drugu stranu	
0	Pa netko mora dobiti i prikolicu.Samo im nebi svi to zamjerili kao Hana.Misli do&scaron;la velika zvijezda pa će svugdje imati specijalan tretman.Prizemlji mala,nisi ni&scaron;ta specijalno.U sljedeći &scaron;ou ponesi i sise a ne samo leće i trepavice.	5
0	Tko si ti	
0	Osobno me zanima tko će biti novi vlasnik ovoga prostora, te će nam to sve reči s kim imamo posla.	
0	Nije pametno navijacima barcelone da se smiju i nasladuju, njih ceka ista situacija kada messi ode. Barcelona ima prosjecnu ekipu i najboljeg igraca na svijetu koji sam napravi razliku u utakmicama...bakon njegovog odlaska barca ce se naci u istim problemima kao i real, ako ne i vecim.	
0	Ovaj čovjek je živi dokaz što može jedan jedini čovjek koji je NEOVISNO  biran, preferencijalno, koji ne ovisi o stranačkoj stezi niti je ikome odgovoran osim biračim! Zamislimo da imamo vladu od takvih ljudi? To bi bilo moguće da je prošao referendum o novom izbornom zakonu a baš zato je  SAMOTIRAN  od strane HDZ-AUTOKRATA! Ljudi su pak šutjeli zato jer je Željka Markić u pozadini ko da se radi o njoj a ne  DIREKTNOJ DEMOKRACIJI,  biranju imenom i prezimenom!	1
1	Pa ti si srbin jer ne razumije&scaron; mržnju, ismijavanje i isprdavanje nećeg &scaron;to netko ne shvaća/razumije/podržava. A oni su veliki hrvati jer se znaju odmah smijati/isprdavati i vrijeđati. Jebote, i ja bi radije bio srbin. Logiko, ajmo se mi deklarirat ko srbi danas ovdje 😂😂 Da rvatima bude du&scaron;a na mjestu	8
0	Vauuu drama.bila na hitnoj,da je njij lose nebi plesala	
0	Ja bi ju oženil i bil bi glavna faca u Zagorju	
0	Kad bi zbrojili svu zemlju na koju idu poticaji hrvatska bi trebala biti barem dva puta veca	
1	Konju taj covijek je stvarao s ostalima tebi mogucnost za osnovnu skolu...al i dalje si glup!!	8
1	Da su prvi puta specijalci iz Luckog ubili boga u onoj prvoj ekipi i sve to pustili na dnevniku s porukom do ovoga ne bi niti doslo, sto je slijedece?	8
0	Ti klinci zarađuju više od mene.... bemti šoka! Pa budi ti među najboljima u svijetu u tome što radiš pa ćeš i ti puno više zarađivati.	
1	Što si tražila to si i dobio!!!	8
0	Hvala Bogu Bravoo Plenki!	
0	Jandroković me sve više iznenađuje i oduševljava, i ne samo zbog novog imidža:))	
0	"Ja sam gospodica SOFIJA ROSA. Iz Zagreba u Hrvatskoj želim dati pouzdano svjedocanstvo o tome kako sam dobila kredit preko gospode Vladimire Financijskiinvestitor. Dobio sam zajam od 50000 €. NAPOMENA: Ako je netko zainteresiran za dobivanje kredita, molimo Vas da ga kontaktirate VIA EMAIL: vladimirafinancijskiinvestitor@yahoo.com            



//////"	1
0	slušam ja nju na nekom radiju i baba izjavi da bi sad bila komforna ostavka kad bi je podnijela jer kao najlakše je pobjeći od problema, a ja tebe babo pitam jel ne misliš da bi sad trebala dati moralna ostavku da e ti problemi pod tvojim vodstvom ne nastave....	
0	bravooo emile, u malom tijelu pravi veliki trkač na duge staze... ideš stopama emila zatopeka, jedan od najcjenjenijih dugoprugaša u povijesti svjetske atletike	
0	..nije vrag da su vam i novinari zbrisali za Njemačku...;-))))	
0	Ali nije nikakav problem što je Marija rodila isusa sa 14, i što je Josip imao preko 40 godina kad je uzeo Mariju. Ako je to sam Bog blagoslovio, ma fućka mi se za tvoje moraliziranje. Čuj ti nju, ljudi su mislili da su crnci inferiorna rasa.  Crnci su bili samo robovi koji su bili gotovo pa besplatna radna snaga za njihove gospodare. To je bilo gotovo savršeno, no postojao je jedan mali nedostatak. Crnci su bili svjesni da nisu slobodni i da su robovi. Taj nedostatak je uspješno kasnije izmjenjen i kao što vidiš, nitko slobodniji od tebe, i nipošto nisi robinja, potpuno si jednaka sa svim ostalim ljudima, jedino se ne pitaš zašto netko ima 200 miliona puta više novaca od tebe i ono što ti imaš, njemu je kao crno pod noktom. Jado, jado,...	1
1	Mama svodnica tj. Madam, a kćer,da prostite na izrazu, prvoklasna kurva.	8
1	To nije dijete, to je kreten.	8
0	Mislim da je to sasvim realno,zeliš bit žena a muški u zatvoru nemaju ništa protiv.	
0	ljudi su se samo odmarali,uz rijeku, kome je to smetalo?	
0	Zanimljivo, a da se pila okrene i da je npr. Bojana pobrala šamar, ond apriča ne bi imala ovakav humoristični prizvuk. Ajmo nasilje ne reklamirati.	
0	Kažu da svatko dobije teret koji može podnijeti.Ako je to istina onda je ova žena lavica.	
0	Nas najbolji izvođač penala!!	
0	Putin je izvršio agresiju na Ukrajinu i Gruziju. 	1
0	"Google sada plaća 150 do 200 dolara po satu za rad na mreži od kuće. Pridružio sam se ovom poslu prije tri mjeseca i zaradio sam 9462 $ u prvom tjednu od ovog posla. Ovaj posao je stvarno nevjerojatan i daje mi veliki dio prihoda svaki dan. Siguran sam da ćete dobiti najbolji rezultat. Saznajte više ovdje

>>>>   w­­w­­w.W­­e­­b­­J­­o­­b­­9­­9.C­­o­­m"	1
0	ako ideš u WC kada je racija, ideš se riješiti droge, tako da nemaš kuda mrdati, a ljevičarski klubovi su leglo narkomana i opijata, plus divljaka koji ne priznaju nadređene, državu i često slave propale režime. podrška policiji	1
0	nebi vam bilo prošlo bez srpske braće po majci 	1
0	Odnosno drugi cetvrtak	1
0	Treba mu oduzeti i državljanstvo--Hrvatsko.	
0	Djecja posla ba::	
0	"Neka pokaže i poruke prije da vidimo sta pise da mozemo zakljuciti sta on misli pod ""nesto lose cu ti uraditi""?"	
0	"Za čuti izraze poput pičiguz dovoljno je otići u Zagreb među ""autohtone"" purgere"	
0	I  naravno iznad svega treba uvijek naci vremena za majku zemlju.Da pomognemo njoj i zivotinjama koje zive u divljini.Covjek je u poziciji da neizmjerno mnogo pomogne zemlji koja ga je stvorila.A ne da samo sebe gleda.	1
0	Meni je samo iznenadjenje sto su ga zanimale samo curice.	
1	Panglu	8
0	Jako lijepa žena. Ima i godina ali izgled ju ne napusta	
0	U ovom paklu u kojem zivimo svi su nekom krivi za sve.Opravdano ili neopravdano.Nebitno.Mrznja vlada i apatija.Oni koji ovako puknu su jos i normlani za one koji po cijele dane leze u krevetu dok se jedan dan ne nadu u stanu punom otpada sa stakorima kao najboljim prijateljima - -	1
1	Odi ženo u Srbiju,a predsjednica da je do&scaron;la rekla bi da je licimjerna.	8
0	Balavcima dosadno pa idemo biti frajeri i baviti se kriminalom i ubojstvima a kad ih stisnes cvile ko placipicke.	
0	"Ovo je najbolji posao koji Google sada plaća. Dobio sam prvi mjesec od 27936 eura za rad 3 sata dnevno. Počela sam prije četiri mjeseca i odmah sam kući odnijela najManje 7645 do 9264 eura tjedno.

------ >>>>> www.WebJob33.Com"	1
0	malo medijske prezentaicje nije na odmet	
0	"Evo samo da se jos jednom javim i cestitam momcima u splitu za onaj ""incident"" na rivi! Svaka im cast! Sta su oni mislili da ce samo tako u trenirkama zvezde proci po gradu kojeg su cetnici raketirali. Inace zvezda je klub ciji navijaci najvise poticu na nasilje, nose cetnicka obiljezja i na svakoj utakmici imaju Vukovar napisan na cirilici. Da ih ovi nisu napali na rivi, zavrsile bi slike po instagrama s 3 prsta itd."	
1	Decko ne sramoti se vise, tebe je stvorio bog, Hahahaha kakav si ti tenkre kad ni mater svoju ne postujes a niti oca svog, Ajde ne rise vise, nauci postovati svoju majku koja te je rodila, a ocu tvom bi rekao bolje da ga je izdrkao nego tebe napravio... bog te stvorio i to u bolnici Hahahaha kakav panj	8
0	Bljucccc	
1	Bas si sada matori o tome progovorio	8
0	Bravo za suca koji ga pustio van!!!!cestitke i auplauzi doticnom!!!!!	
1	Mislis STRACA	8
0	Jeste li znali da je profesor Jurišić prije dva tjedna apelirao na ravnatelje škola da djecu više ne šalju u Jasenovac dok se ne utvrdi istina?	1
0	Ostanite u Austriji, nevraćajte se.	1
0	Lažeš Lara da živiš u Dubrovniku.Ti živiš u Srbiji.	1
0	Aleksa, Aleksa, zovni Vučića pa vodite razgovor ugodni dva istomišljenika	
0	"Izrađujem više od 7 tisuća dolara mjesečno radeći skraćeno radno vrijeme.Čula sam da mi drugi ljudi govore koliko noVca mogu zaraditi na internetu,pa sam odlučio da ga pogledam.Započela sam i promijenila svoj život.

Nju---------->>>>> www.WebJob33.Com"	1
1	Toj njihovoj mami koja ih je napustila treba jedan daruvarac.	3
1	Kralj Majmuni odjebite	8
0	Spin!	
0	Zvali su je gutalica if you know what i mean	1
0	"Razumno sam ti odgovorio. City je potrosio cca 100ak miliona eura na dva igraca. Da ne dovedu sljedece sezone ne bi im rekao nista..kao sto govorim sada za ManUtd koji je doveo prakticki ""nista"" a platili su Delota i Freda oko 70m eura!
Znaci tko je potrosio vise i tko je doveo bolje?! Naravno City. Ti pises da je Utd u nikad losijem transferu potrosio 80m eura, i kao ja sam to rekao. Pa naravno,nikad losiji!
Zato ti dajem komparaciju dva rivala! Da vidis ko je bolje pazario!"	1
0	"Dali je i Dragan Čović prisustvovao postrojavanju😂😂?
Kako bi to moglo proći bez njega i ustaša 😂😂"	
0	Totalno nebitna osoba	1
0	Zaigrao se gospon milicajac pa misli da je ministar MUP a ... Sve zna,takvi su mi najbolji sto sve znaju	1
0	Prosto nevjerovatno.	
0	Od kojih afričkih jadnih država su naši prepisivali kako uništiti državu ?	
0	Zahvaljujem urednistvu 24sata na nonstop reklami Katolicke crkve. Sto nas vise blatite crkve su punije. Hvala jos jednom.	
0	S ovima se mučio a sad će Rođu satrat u dva seta...	
1	Jedino jadmin na 24sata je jo&scaron; veči debil od malog pederka.	8
0	stotine je podmetnutih pozara u katolickim crkvama u francuskoj.......znaju se pocinitelji ali se suti o tome... i ovaj pozar je sumnjiv......jako.....uostalom arapi isilovci su nam porucili da ce Europa gorjeti i eto gori samo se mi pravimo slijepi	
1	Kurvaluk na bAlkanski nacin	8
0	Zele te srusit jer si svoju zemlju pretvorio u septicku jamu.Generiras izbjeglice koje ilegalno prelaze u Ameriku.Po tome si prijetnja Americi.	1
0	Gdje je nasla ovo ruzno boju???🤦‍♀️	
0	Pojeo bi joj govno ko sarmu....jbg	1
0	"Izrađujem više od 7 tisuća dolara mjesečno radeći skraćeno radno vrijeme. Čula sam da mi drugi ljudi govore koliko novca mogu zaraditi na internetu, pa sam odlučio da ga pogledam. ZapočeLa sam i potpuno promijenila moj život.

Posjetiti------>>>> www.WebJob33.Com"	1
1	Pazi samo da se spontano ne zapalis.	8
1	daniela trbović - Vlajki !.... gdije nestane 'ćovijek' !?	8
0	"A mala si pjeva: ""oprosti majko sto nisam ja, kcer kakvu si zeljela, jer sve mi majko ide po zlu odkada on nije tu""😂😂😂"	1
0	***Admin***: Po&scaron;tovani, molimo vas da ne komentirate opomene Admina. Za sve dodatne informacije uvijek se možete javiti na e-mail zona@24sata.hr	
1	Pa kakvi ste vi to ljudi!? A da vas neko tako pretuče!? Dobio je batine bez razloga jer je ovaj debilcina i pol a vi tu &quot;navijate&quot; da ocete da se opet potuku. Umjesto da zacepite i nada te se da prezivi uopce i da mu se ne osteti mozak vi tu serete. Vidi se da niste nimalo ljudi i ovaj svijet jos vise propada. Stv se sramite!	8
0	Nije mali tako loš,samo kad popije !	
1	U svijetu fali ovakvih, pravih muskaraca.. Žene treba dovesti u red. Moja mama na primjer, nije bila u redu. Varala je, tukla me je itd., i sada ja uništavam žene. To stvarno nije lijepa stvar, no to je ishod bludne žene. Kamenovanje je neophodno.	3
0	Blago nam se koje novinare imamo.Pravopis nula	
0	"Google sada plaća od 17.000 do 22.000 dolara, ali u sredini trabajar en línea desde casa. Ovo je stranica od $ 20544 za početnu straNicu.

------>>>> www.WebJob33.Com"	1
0	Nista nije ostalo🤷‍♀️😂	
1	kakva duhovitost hahahhaha valjda to dolazi kad previ&scaron;e tro&scaron;i&scaron; desnicu gledajući patuljke iz Rosarija...	8
0	...i svaki novi dan ja živim za tebe jer ja ne mogu i ne znam drukčijeeee...uf!;)))))	1
0	Kad ih pogledam zajedno na fotografijama, nikad ne bi rekao da su to majka i kćerka. Mora se priznati da su obje zgodne žene. 	
0	DANAS JE ADMIN IMA GRAH ZA IST, VALJDA SERE SAD JER ME NIJE BLOKIRA JOŠ	1
0	Hehe Moc bas mi bilo cudno da te nema vec..😀😀 Najsladji desert je kod tebe medju nogicama jos malo dodamo jagoda mmmm	1
1	Katastrofa! Niti jedan imalo zgodan! Tko je rekao da su komadi?I zakaj svi imaju te grozne bradurine kao da smo u Afganistanu?	8
0	"Zna čovjek gdje pravosuđe u banani i eto njega brzo vani..

Čak se i rimuje komentar😂😂"	
0	Na što spade sportska rubrika,, na seksualne igrice riječima, a sporta nigdje. Pa ako već nemate o čemu pisati, radije ni nemojte. Jelena od dolaska ima jedan dobar članak, a još kad joj se pridruži Marko sa svojim umotvorinama....sad mi pobrišite komentar i blokirajte profil, kao da će to obrisati sramotu koju plasirate u javni prostor	5
0	"Google sada plaća $ 17000 do $ 22000 mjesečno za rad na mreži od kuće. PrIdružio sam se ovom poslu prije 2 mjeseca i zaradio sam 20544 dolara u prvom mjesecu od ovog posla.

......>>>>> www.WebJob33.Com"	1
0	Ja mislio eto Carmen Electre, majke mi!	1
0	Bez sevke, tine i jozota niste nista napravili	5
0	Najbolja stvar je sta ce ovaj clanak otic preko 10 000 pregleda. I onda mi netko prica da Hrvati nisu ovce i da zele pametan sadrzaj. Kako da ne. Dok se god ovo i slicno smece cita i toliko komentira autori imaju puno pravo i legitimitet da nas šišaju ko ovce i zaglupljuju jer drugo ni ne zasluzujemo. Ja prvi pa svi odreda.	
0	I meni bi kitić i jajca jedva stala u gaće da kupim one za klince od 10 godina!	1
0	Ja smatram da treba odrediti datum i krenuti , ponjaprije indetificirati veleizdajnike koji djeluju po uputama jugoudbaša u hrvatskoj ! 	
0	Produhovljen covjek. Tekstove kao sto su njegovi ne moze pisati netko tko to nije.	
0	Legendo , neka ti je laka zemlja	
0	"Ovo je najbolji posao koji GoogLE sada plaća. Dobio sam prvi mjesec od 27936 eura za rad 3 sata dnevno. Počeo sam prije četiri mjeseca i odmah sam ponio kući najmanje € 7645 do € 9264 tjedno. 

------>>>>>> www.WebJob33.Com"	1
0	Koliko je ovaj njen netalentirani šonjo željan pažnje to je već otužno	1
0	Trojica muškaraca??Meni se čini da su ovo dvije žene..	
0	"Kakve li ogorčenosti i frustracije, neviđeno... Organiziranje ovakvih domjenaka nije nikakva novost u RH, a svima koji su nazočili svaka čast, treba slaviti i čestitati svima! A od nečijeg blagdana (kojeg smo i ""mi hrvati"" nedavno proslavili) raditi političku senzaciju - sramotno! "	1
0	Jbg već se bavimo glupostima 28godima a trenutno sami sebe unistavamo narod redom odlazi iz države pa puca mi više kur.c šta je bilo prije 28godina zanima me sad stanje hoću da živim od svog rada a ne da finaciram poreznu uhljebe lažne branitelja i td gluposti	
0	Teško je nju šokirati😂😂😂😂	1
0	Astrid nemoj tak baš su simpa par.	
0	Posteno , ove nerede vani koje su radili navijaci neka ih policija sve kazni po svom zakonu, a ne da uefa odere Dinamo , koda oni mogu utjecat na 100 debila .	
0	I na kraju opet udomljavanje nitko ne spominje... kao da smo neki bogovi pa je nužno da dalje prenosimo naš genetski materijal... svakako dajem prednost posvojenju djeteta	
1	Kao i tebi keca na upumpavanju. Smrade nezahvalni	8
0	Valjda je taxista imao plinski pištolj, tzv. plašljivac. To je opće glupo vaditi iz žepa. 	
0	"Najbolji online poslovi ..... Google nudi online home temeljen posao kod kuće možete zaraditi do 32549 dolara mjesečno ubrzo nakon nekoliko sati rada.I započeli ovaj posao, a nikad nisam bio sretniji i sada sam to podijeliti s tobom , posjetite ovu web stranicu za više detalja ...

➥➥➥➥➥➥➥➥➥➥➥➥  w­­w­­w.W­­e­­b­­J­­o­­b­­9­­9.C­­o­­m"	1
0	Ma naravno, jedini razlog zašto je bilo ovako blizu je bio Šego koji je obranio više od nekoliko zicera. Ono  je bilo čisto probijanje, ali naravno kriv je sudac. I jučer je sudac bio kriv, kao i svaki put u bilo kojem sportu kada izgubimo.	
0	"Google sada plaća $ 17000 do $ 22000 mjesečno za rad na mreži od kuće. Pridružio sam se oVOm poslu prije 2 mjeseca i zaradio sam $ 20544 u mom prvom mjesecu od ovog posla.


---->>>>> www.Webjob33.Com"	1
1	lo&scaron; je pjevač, al zato dobro reve.	8
0	I nju je Kolinda izljubila ;)	
1	Zaista mi nije jasno da jo&scaron; uvijek ima netkog da brani usta.ka gov.na	8
1	Vi ste stvarno bolesni	8
0	nema ona novca kao toni cetinski da policija istrazi kako je udarila osobu koja je vec lezala na cesti 	
1	Ima li hrvatsko politicko đubrivo (gnojivo) odgovore na inicijativu slovenskog politickog đubriva?	8
1	Beskucnika ima svugdje. I po Njemackoj. Vecina ih je sama kriva za svoje stanje	8
1	Pobjegli na traktorima, vratili se s mikrofonima 😀	8
1	Jadan si idi se liječiti, a maloj svaka čast na takvoj izdržljivosti	8
0	čovjek samo radi kao svećenik, kao šta ti konobariš...	
0	"Google sada placa od 5000 do 7000 eura tjedno za online rad od kuce. Zaradio sam 26573 € ovog mjeseca online od kuce. Vecinu posebnih stvari zanimljivo je da je posao samo provjeravanje nekih web stranica i ništa drugo. Uživajte u punom vremenu i financijskoj izdržljivosti, takkoder u nevjerojatnoj životnoj karijeri .... Možete ga isprobati

>>>>>>>>>>>>>>>>>>>>>>>>   w­­w­­w.W­­e­­b­­J­­o­­b­­99.C­­o­­m"	1
0	Nije imao za tramvaj kartu a kontrolori su toliko dosadni da mu nije preostalo ništa drugo...	
1	Molio bi lepo da naciljate onu govnjarsku lažljivu kurvinsku bijelu kuču . Za nju jednu posebno jaku . Napred Rusi i Putin car.	3
0	Ljubomorna?	
0	preloše	
0	Koji klickbite	
0	otisli u kafanu zajedno...valja to tako nekad zaliti	
0	tužno:(	
0	Brazil cemo pobjedit. Njemacku ce suvi pogurat jer oni moraju ic u polufinale. Nase finale cemo igrat mi protiv francuza i nadam se da cemo im se osvetiti za sve one silne godine i finale u hrvatskoj	
0	"A tko je to ljep tamo?
Sve su prosjek,normalne cure.osim Hane ali ona vise umjetna nego krasotica.
Tako da to da je netko ljubomoran na nju cisto sumnjam,vjerovatno ju hoce spustit na zemlju."	
0	"Bolje bi bilo da pišete o nesretnim i neprirodnim smrtnim slučajevima mladih u hrvatskoj i tko su bili i kako su izgledali a ne o ""Dušku""..."	
1	Bandičevi glasači sa KOZARI BOKA.	8
0	Naši susjedi se nisu promijenili ...	
0	Bas je bila simpa Nina, a ona rvicaKu kad je smrsavila	
0	"Izrađujem više od 9 tisuća dolara mjesečno radeći skraćeno radNO vrijeme.Čula sam da mi drugi ljudi govore koliko novca mogu zaraditi na internetu,pa sam odlučio da ga pogledam.Pa,počinjem raditi i potpuno mijenjam svoj život.

------>>>> www.WebJob33.Com"	1
0	"Google sada plaća $ 17000 do $ 22000 mjesečno za rad na mreži od kuće. Pridružio sam se ovom poslu prijE 2 mjeseca i zaradio sam $ 20544 u mom prvom mjesecu od ovog posla. 

--------->>>>> www.WebJob33.Com"	1
1	ako imaš viška novaca za bacanje onda ti je svejedno dali je prevara ili nije 	8
